{"annotation_seed":{"kind":"blank_human_annotation","warning":"Not gold until every visible line and page coverage are human_verified."},"coverage":{"all_structure_exhaustively_reviewed":false,"all_typography_exhaustively_reviewed":false,"all_visible_lines_exhaustively_reviewed":true,"closed_world":true,"reviewer":"裴浩然","status":"draft","unresolved_notes":"","verified_at":null},"image":{"height":3167,"mime_type":"image/png","sha256":"a2d627f7a58ca9a1fd314ad983ab582fa9e2be9ccbc3b4cb434936425c320586","width":1950},"lines":[{"bbox":[304,401,1638,448],"canonical_reference":null,"column_id":"main","content_class":"main_text","geometry_status":"human_verified","hierarchy_level":null,"inline_spans":[],"language":"mixed","leaf_id":"single","line_id":"dillon-phronesis29-pdf004-native-0000","note_id":null,"paragraph_role":"continuation","reading_order":0,"source":"human_draft","structure_status":"candidate_unverified","text":"first-principle (ἀρχή) is not yet such as are those things of which it is the","transcription_status":"human_verified","typography_status":"candidate_unverified"},{"bbox":[306,457,1637,499],"canonical_reference":null,"column_id":"main","content_class":"main_text","geometry_status":"human_verified","hierarchy_level":null,"inline_spans":[{"bbox":null,"end_char":44,"semantic_role":"citation","span_id":"dillon-phronesis29-pdf004-native-0001-qa-span-000","start_char":39,"styles":["italic"],"target_id":null,"text":"arche"}],"language":"eng","leaf_id":"single","line_id":"dillon-phronesis29-pdf004-native-0001","note_id":null,"paragraph_role":"continuation","reading_order":1,"source":"human_draft","structure_status":"candidate_unverified","text":"principle’. So that if something is an arche of all existent things, it cannot","transcription_status":"human_verified","typography_status":"candidate_unverified"},{"bbox":[306,508,1639,554],"canonical_reference":null,"column_id":"main","content_class":"main_text","geometry_status":"human_verified","hierarchy_level":null,"inline_spans":[],"language":"eng","leaf_id":"single","line_id":"dillon-phronesis29-pdf004-native-0002","note_id":null,"paragraph_role":"continuation","reading_order":2,"source":"human_draft","structure_status":"candidate_unverified","text":"itself have existence in the sense that they have (though it may be thought","transcription_status":"human_verified","typography_status":"candidate_unverified"},{"bbox":[306,561,1639,609],"canonical_reference":null,"column_id":"main","content_class":"main_text","geometry_status":"human_verified","hierarchy_level":null,"inline_spans":[],"language":"eng","leaf_id":"single","line_id":"dillon-phronesis29-pdf004-native-0003","note_id":null,"paragraph_role":"continuation","reading_order":3,"source":"human_draft","structure_status":"candidate_unverified","text":"to subsist in some higher way: one does not see it being described as simply","transcription_status":"human_verified","typography_status":"candidate_unverified"},{"bbox":[309,615,1637,663],"canonical_reference":null,"column_id":"main","content_class":"main_text","geometry_status":"human_verified","hierarchy_level":null,"inline_spans":[],"language":"mixed","leaf_id":"single","line_id":"dillon-phronesis29-pdf004-native-0004","note_id":null,"paragraph_role":"continuation","reading_order":4,"source":"human_draft","structure_status":"candidate_unverified","text":"μὴ ὄν). Plainly something that Speusippus said allows Aristotle to allege at","transcription_status":"human_verified","typography_status":"candidate_unverified"},{"bbox":[308,669,1639,715],"canonical_reference":null,"column_id":"main","content_class":"main_text","geometry_status":"human_verified","hierarchy_level":null,"inline_spans":[{"bbox":null,"end_char":4,"semantic_role":"citation","span_id":"dillon-phronesis29-pdf004-native-0005-qa-span-000","start_char":0,"styles":["italic"],"target_id":null,"text":"Met."}],"language":"eng","leaf_id":"single","line_id":"dillon-phronesis29-pdf004-native-0005","note_id":null,"paragraph_role":"continuation","reading_order":5,"source":"human_draft","structure_status":"candidate_unverified","text":"Met. 1092a11ff. (= Fr. 43), and 1072b30ff. (= Fr. 42) that he compares the","transcription_status":"human_verified","typography_status":"candidate_unverified"},{"bbox":[310,723,1638,770],"canonical_reference":null,"column_id":"main","content_class":"main_text","geometry_status":"human_verified","hierarchy_level":null,"inline_spans":[],"language":"eng","leaf_id":"single","line_id":"dillon-phronesis29-pdf004-native-0006","note_id":null,"paragraph_role":"continuation","reading_order":6,"source":"human_draft","structure_status":"candidate_unverified","text":"First Principle to the seed of animals or plants. In Aristotelian terms this","transcription_status":"human_verified","typography_status":"candidate_unverified"},{"bbox":[309,779,1640,822],"canonical_reference":null,"column_id":"main","content_class":"main_text","geometry_status":"human_verified","hierarchy_level":null,"inline_spans":[],"language":"mixed","leaf_id":"single","line_id":"dillon-phronesis29-pdf004-native-0007","note_id":null,"paragraph_role":"continuation","reading_order":7,"source":"human_draft","structure_status":"candidate_unverified","text":"makes it imperfect (ἀτελής), since the seed has not attained its proper τέλος,","transcription_status":"human_verified","typography_status":"candidate_unverified"},{"bbox":[309,832,1641,875],"canonical_reference":null,"column_id":"main","content_class":"main_text","geometry_status":"human_verified","hierarchy_level":null,"inline_spans":[],"language":"eng","leaf_id":"single","line_id":"dillon-phronesis29-pdf004-native-0008","note_id":null,"paragraph_role":"continuation","reading_order":8,"source":"human_draft","structure_status":"candidate_unverified","text":"as the animal and plant concerned. It also conflicts with Aristotle’s doctrine","transcription_status":"human_verified","typography_status":"candidate_unverified"},{"bbox":[312,883,1639,930],"canonical_reference":null,"column_id":"main","content_class":"main_text","geometry_status":"human_verified","hierarchy_level":null,"inline_spans":[],"language":"eng","leaf_id":"single","line_id":"dillon-phronesis29-pdf004-native-0009","note_id":null,"paragraph_role":"continuation","reading_order":9,"source":"human_draft","structure_status":"candidate_unverified","text":"that actuality precedes potentiality. But even if Speusippus did compare","transcription_status":"human_verified","typography_status":"candidate_unverified"},{"bbox":[312,937,1640,983],"canonical_reference":null,"column_id":"main","content_class":"main_text","geometry_status":"human_verified","hierarchy_level":null,"inline_spans":[],"language":"eng","leaf_id":"single","line_id":"dillon-phronesis29-pdf004-native-0010","note_id":null,"paragraph_role":"continuation","reading_order":10,"source":"human_draft","structure_status":"candidate_unverified","text":"the First Principle to a seed, he need not for that reason have declared it to","transcription_status":"human_verified","typography_status":"candidate_unverified"},{"bbox":[312,989,1639,1036],"canonical_reference":null,"column_id":"main","content_class":"main_text","geometry_status":"human_verified","hierarchy_level":null,"inline_spans":[],"language":"eng","leaf_id":"single","line_id":"dillon-phronesis29-pdf004-native-0011","note_id":null,"paragraph_role":"continuation","reading_order":11,"source":"human_draft","structure_status":"candidate_unverified","text":"be imperfect, in the Aristotelian sense. We do not, I think, have to assume","transcription_status":"human_verified","typography_status":"candidate_unverified"},{"bbox":[312,1044,1617,1091],"canonical_reference":null,"column_id":"main","content_class":"main_text","geometry_status":"human_verified","hierarchy_level":null,"inline_spans":[],"language":"eng","leaf_id":"single","line_id":"dillon-phronesis29-pdf004-native-0012","note_id":null,"paragraph_role":"continuation","reading_order":12,"source":"human_draft","structure_status":"candidate_unverified","text":"development either upwards or downwards in the Speusippean universe.","transcription_status":"human_verified","typography_status":"candidate_unverified"},{"bbox":[959,1179,1008,1222],"canonical_reference":null,"column_id":"main","content_class":"section_heading","geometry_status":"human_verified","hierarchy_level":1,"inline_spans":[],"language":"eng","leaf_id":"single","line_id":"dillon-phronesis29-pdf004-native-0013","note_id":null,"paragraph_role":"standalone","reading_order":13,"source":"human_draft","structure_status":"candidate_unverified","text":"III","transcription_status":"human_verified","typography_status":"candidate_unverified"},{"bbox":[314,1259,1643,1302],"canonical_reference":null,"column_id":"main","content_class":"main_text","geometry_status":"human_verified","hierarchy_level":null,"inline_spans":[{"bbox":null,"end_char":67,"semantic_role":"citation","span_id":"dillon-phronesis29-pdf004-native-0014-qa-span-000","start_char":63,"styles":["italic"],"target_id":null,"text":"DCMS"}],"language":"eng","leaf_id":"single","line_id":"dillon-phronesis29-pdf004-native-0014","note_id":null,"paragraph_role":"start","reading_order":14,"source":"human_draft","structure_status":"candidate_unverified","text":"This is relevant to the next alleged point of conflict between DCMS and","transcription_status":"human_verified","typography_status":"candidate_unverified"},{"bbox":[315,1311,1644,1358],"canonical_reference":null,"column_id":"main","content_class":"main_text","geometry_status":"human_verified","hierarchy_level":null,"inline_spans":[],"language":"eng","leaf_id":"single","line_id":"dillon-phronesis29-pdf004-native-0015","note_id":null,"paragraph_role":"continuation","reading_order":15,"source":"human_draft","structure_status":"candidate_unverified","text":"Aristotle’s testimony, the relation of Beauty and Goodness to the First","transcription_status":"human_verified","typography_status":"candidate_unver